{
  "slug": "mistral-nemo-via-nvidia",
  "name": "Mistral NeMo (via NVIDIA)",
  "website_url": "https://developer.nvidia.com/nemo",
  "logo_url": "https://www.google.com/s2/favicons?sz=128&domain=developer.nvidia.com",
  "description": "Mistral NeMo (via NVIDIA) is an AI tool in the models category. See the official site for features and availability.",
  "category": "models",
  "use_cases": [
    {
      "title": "Overview",
      "details": "Use Mistral NeMo (via NVIDIA) for models tasks."
    },
    {
      "title": "Teams",
      "details": "Boost collaboration and productivity."
    },
    {
      "title": "Developers",
      "details": "Integrations and APIs where available."
    }
  ],
  "pros": [
    "Well-known vendor",
    "Active ecosystem"
  ],
  "cons": [
    "Features vary by plan/region",
    "Pricing may change"
  ],
  "pricing_plans": [
    {
      "name": "See pricing",
      "price": "See pricing page",
      "currency": "USD",
      "billing_cycle": "monthly",
      "features": [
        "Refer to vendor site"
      ],
      "trial_available": true,
      "url": "https://developer.nvidia.com/nemo/pricing"
    }
  ],
  "company_details": {
    "name": "NVIDIA",
    "legal": {
      "terms_url": "https://developer.nvidia.com/nemo/terms",
      "privacy_url": "https://developer.nvidia.com/nemo/privacy"
    }
  },
  "reviews_and_ratings": [
    {
      "source_name": "Product Hunt",
      "source_type": "social",
      "url": "https://www.producthunt.com/search?q=Mistral%20NeMo%20%28via%20NVIDIA%29"
    }
  ],
  "image": "https://developer.nvidia.com/nemo",
  "best_for": [
    "Individuals",
    "Teams",
    "Enterprises"
  ],
  "models": [
    {
      "name": "Proprietary / various",
      "provider": "NVIDIA",
      "modality": "text"
    }
  ],
  "technical_information": {
    "api_available": true,
    "api_docs_url": "https://developer.nvidia.com/nemo/docs",
    "sdk_languages": [
      "Python",
      "JavaScript"
    ],
    "hosting_options": [
      "SaaS",
      "API"
    ],
    "integrations": []
  },
  "key_differentiator": "Part of the NVIDIA ecosystem.",
  "case_studies": [],
  "vendor_details": {
    "support_url": "https://developer.nvidia.com/nemo/help"
  },
  "flags": {
    "is_open_source": false,
    "has_free_tier": false,
    "requires_login": true,
    "has_api": true
  },
  "gallery": [
    {
      "url": "https://developer.nvidia.com/nemo",
      "caption": "Mistral NeMo (via NVIDIA)"
    }
  ],
  "tutorials_youtube": [],
  "qa": [
    {
      "question": "Is there a free plan?",
      "answer": "See the vendor pricing page for current details.",
      "source_url": "https://developer.nvidia.com/nemo/pricing"
    },
    {
      "question": "Is there an API?",
      "answer": "Check the docs link for availability.",
      "source_url": "https://developer.nvidia.com/nemo/docs"
    },
    {
      "question": "Where is support?",
      "answer": "Use the help center or contact page.",
      "source_url": "https://developer.nvidia.com/nemo/help"
    },
    {
      "question": "What about privacy?",
      "answer": "Refer to the vendor privacy policy.",
      "source_url": "https://developer.nvidia.com/nemo/privacy"
    },
    {
      "question": "Are there usage limits?",
      "answer": "Limits vary by plan; see pricing and docs.",
      "source_url": "https://developer.nvidia.com/nemo/pricing"
    },
    {
      "question": "Is there an enterprise plan?",
      "answer": "Often available via sales.",
      "source_url": "https://developer.nvidia.com/nemo/pricing"
    },
    {
      "question": "Do they have tutorials?",
      "answer": "YouTube often hosts tutorials; see the Tutorials section.",
      "source_url": "https://www.youtube.com/"
    },
    {
      "question": "Can I use it commercially?",
      "answer": "Check the terms of service for license and usage rights.",
      "source_url": "https://developer.nvidia.com/nemo/terms"
    },
    {
      "question": "Is there a mobile app?",
      "answer": "Check the official site for platform availability.",
      "source_url": "https://developer.nvidia.com/nemo"
    },
    {
      "question": "Which regions are supported?",
      "answer": "Availability may vary by region; refer to the official site.",
      "source_url": "https://developer.nvidia.com/nemo"
    }
  ],
  "official_video": "https://www.youtube.com/",
  "last_crawled_at": "2025-10-19T13:29:02.009101"
}