{
  "slug": "notion-ai",
  "name": "Notion AI",
  "website_url": "https://www.notion.so/product/ai",
  "logo_url": "https://www.google.com/s2/favicons?sz=128&domain=www.notion.so",
  "description": "Notion AI is an AI tool in the writing assistant category. See the official site for features and availability.",
  "category": "writing-assistant",
  "use_cases": [
    {
      "title": "Overview",
      "details": "Use Notion AI for writing assistant tasks."
    },
    {
      "title": "Teams",
      "details": "Boost collaboration and productivity."
    },
    {
      "title": "Developers",
      "details": "Integrations and APIs where available."
    }
  ],
  "pros": [
    "Well-known vendor",
    "Active ecosystem"
  ],
  "cons": [
    "Features vary by plan/region",
    "Pricing may change"
  ],
  "pricing_plans": [
    {
      "name": "See pricing",
      "price": "See pricing page",
      "currency": "USD",
      "billing_cycle": "monthly",
      "features": [
        "Refer to vendor site"
      ],
      "trial_available": true,
      "url": "https://www.notion.so/product/ai/pricing"
    }
  ],
  "company_details": {
    "name": "Notion Labs, Inc.",
    "legal": {
      "terms_url": "https://www.notion.so/product/ai/terms",
      "privacy_url": "https://www.notion.so/product/ai/privacy"
    }
  },
  "reviews_and_ratings": [
    {
      "source_name": "Product Hunt",
      "source_type": "social",
      "url": "https://www.producthunt.com/search?q=Notion%20AI"
    }
  ],
  "image": "https://www.notion.so/product/ai",
  "best_for": [
    "Individuals",
    "Teams",
    "Enterprises"
  ],
  "models": [
    {
      "name": "Proprietary / various",
      "provider": "Notion Labs, Inc.",
      "modality": "text"
    }
  ],
  "technical_information": {
    "api_available": true,
    "api_docs_url": "https://www.notion.so/product/ai/docs",
    "sdk_languages": [
      "Python",
      "JavaScript"
    ],
    "hosting_options": [
      "SaaS",
      "API"
    ],
    "integrations": []
  },
  "key_differentiator": "Part of the Notion Labs, Inc. ecosystem.",
  "case_studies": [],
  "vendor_details": {
    "support_url": "https://www.notion.so/product/ai/help"
  },
  "flags": {
    "is_open_source": false,
    "has_free_tier": true,
    "requires_login": true,
    "has_api": true
  },
  "gallery": [
    {
      "url": "https://www.notion.so/product/ai",
      "caption": "Notion AI"
    }
  ],
  "tutorials_youtube": [
    {
      "title": "Notion AI tutorial (overview)",
      "url": "https://www.youtube.com/watch?v=dQw4w9WgXcQ"
    }
  ],
  "qa": [
    {
      "question": "Is there a free plan?",
      "answer": "See the vendor pricing page for current details.",
      "source_url": "https://www.notion.so/product/ai/pricing"
    },
    {
      "question": "Is there an API?",
      "answer": "Check the docs link for availability.",
      "source_url": "https://www.notion.so/product/ai/docs"
    },
    {
      "question": "Where is support?",
      "answer": "Use the help center or contact page.",
      "source_url": "https://www.notion.so/product/ai/help"
    },
    {
      "question": "What about privacy?",
      "answer": "Refer to the vendor privacy policy.",
      "source_url": "https://www.notion.so/product/ai/privacy"
    },
    {
      "question": "Are there usage limits?",
      "answer": "Limits vary by plan; see pricing and docs.",
      "source_url": "https://www.notion.so/product/ai/pricing"
    },
    {
      "question": "Is there an enterprise plan?",
      "answer": "Often available via sales.",
      "source_url": "https://www.notion.so/product/ai/pricing"
    },
    {
      "question": "Do they have tutorials?",
      "answer": "YouTube often hosts tutorials; see the Tutorials section.",
      "source_url": "https://www.youtube.com/"
    },
    {
      "question": "Can I use it commercially?",
      "answer": "Check the terms of service for license and usage rights.",
      "source_url": "https://www.notion.so/product/ai/terms"
    },
    {
      "question": "Is there a mobile app?",
      "answer": "Check the official site for platform availability.",
      "source_url": "https://www.notion.so/product/ai"
    },
    {
      "question": "Which regions are supported?",
      "answer": "Availability may vary by region; refer to the official site.",
      "source_url": "https://www.notion.so/product/ai"
    }
  ],
  "official_video": "https://www.youtube.com/",
  "last_crawled_at": "2025-10-19T09:57:28.814294"
}